{
  "channel": "stable",
  "checkpoint_ref": "sources/redeven-official-github/signing-ledger/checkpoints/current.json",
  "checkpoint_sha256": "5555555555555555555555555555555555555555555555555555555555555555",
  "consistency_proof_ref": "sources/redeven-official-github/signing-ledger/proofs/consistency/aaaaaaaaaaaaaaaaaaaaaaaaaaaaaaaaaaaaaaaaaaaaaaaaaaaaaaaaaaaaaaaa/5555555555555555555555555555555555555555555555555555555555555555.json",
  "consistency_proof_sha256": "8888888888888888888888888888888888888888888888888888888888888888",
  "inclusion_proof_ref": "sources/redeven-official-github/signing-ledger/proofs/inclusion/1111111111111111111111111111111111111111111111111111111111111111.json",
  "inclusion_proof_sha256": "6666666666666666666666666666666666666666666666666666666666666666",
  "latest_proof_ref": "sources/redeven-official-github/signing-ledger/proofs/latest/1111111111111111111111111111111111111111111111111111111111111111.json",
  "latest_proof_sha256": "7777777777777777777777777777777777777777777777777777777777777777",
  "receipt_ref": "sources/redeven-official-github/signing-ledger/receipts/1111111111111111111111111111111111111111111111111111111111111111.json",
  "receipt_sha256": "4444444444444444444444444444444444444444444444444444444444444444",
  "schema_version": "redevplugin.release_signing_ledger_evidence.v1",
  "signature_envelope_sha256": "3333333333333333333333333333333333333333333333333333333333333333",
  "signing_preimage_sha256": "2222222222222222222222222222222222222222222222222222222222222222",
  "source_id": "redeven-official-github",
  "subject_identity_sha256": "1111111111111111111111111111111111111111111111111111111111111111"
}
